{"$schema":"https://json-schema.org/draft/2020-12/schema","$id":"style-anchor-feedback.schema.json","type":"object","additionalProperties":false,"required":["schema_version","artifact_type","deck_id","slide_id","revision","final_preview_sha256","decision","change_scope","user_message_sha256"],"properties":{"schema_version":{"const":"1.0"},"artifact_type":{"const":"style_anchor_feedback"},"deck_id":{"type":"string","minLength":1},"slide_id":{"type":"string","minLength":1},"revision":{"type":"integer","minimum":1},"final_preview_sha256":{"type":"string","pattern":"^[a-f0-9]{64}$"},"decision":{"enum":["accepted","changes_requested","rejected"]},"change_scope":{"enum":["none","local_visual","global_style","content"]},"user_message_sha256":{"type":"string","pattern":"^[a-f0-9]{64}$"}}}
